Age_of_person,Balance_of_accounts_with_government_superannuation_funds,Balance_of_accounts_with_non_government_superannuation_funds,Country_of_birth_by_main_language,Current_weekly_amount_of_Commonwealth_Rent_Assistance,Current_weekly_benefit_from_employer_provided_car_park_non_salary_sacrifice,Current_weekly_benefit_from_employer_provided_child_care_non_salary_sacrifice,Current_weekly_benefit_from_employer_provided_computer_non_salary_sacrifice,Current_weekly_benefit_from_employer_provided_housing_non_salary_sacrifice,Current_weekly_benefit_from_employer_provided_low_interest_loans_non_salary_sacrifice,Current_weekly_benefit_from_employer_provided_shares_non_salary_sacrifice,Current_weekly_benefit_from_employer_provided_superannuation_above_min_non_salary_sacrifice,Current_weekly_benefit_from_employer_provided_telephone_non_salary_sacrifice,Current_weekly_benefit_from_employer_provided_vehicle_non_salary_sacrifice,Current_weekly_cash_income_from_own_unincorporated_business_prev_SIH_basis_using_PFY_data,Current_weekly_cash_income_from_own_unincorporated_business_reported,Current_weekly_cash_income_from_own_unincorporated_business_flag,Current_weekly_Child_Care_Tax_Rebate_amount,Current_weekly_employee_cash_income_from_bonuses,Current_weekly_employee_income_of_children_HES_only,Current_weekly_employee_income_salary_sacrificed_for_child_care,Current_weekly_employee_income_salary_sacrificed_for_computer,Current_weekly_employee_income_salary_sacrificed_for_housing,Current_weekly_employee_income_salary_sacrificed_for_other_benefits,Current_weekly_employee_income_salary_sacrificed_for_payment_of_household_personal_bills,Current_weekly_employee_income_salary_sacrificed_for_superannuation,Current_weekly_employee_income_salary_sacrificed_for_telephone_charges,Current_weekly_employee_income_salary_sacrificed_for_vehicle,Current_weekly_financial_support_provided_to_family_members_not_in_the_household,Current_weekly_income_as_beneficiary_of_a_trust_excl_public_unit_trusts_and_employment_income,Current_weekly_income_as_silent_partner,Current_weekly_income_from_accident_compensation_and_sickness_insurance,Current_weekly_income_from_age_pension,Current_weekly_income_from_Austudy_Abstudy,Current_weekly_income_from_Baby_Bonus_payment,Current_weekly_income_from_carer_allowance,Current_weekly_income_from_carer_payment,Current_weekly_income_from_child_support_maintenance,Current_weekly_income_from_disability_pension_DVA,Current_weekly_income_from_disability_support_pension,Current_weekly_income_from_dividends_reported,Current_weekly_income_from_family_members_not_living_in_the_household,Current_weekly_income_from_family_tax_benefits_modelled,Current_weekly_income_from_family_tax_benefits_modelled_basis,Current_weekly_income_from_financial_institution_account_interest_reported,Current_weekly_income_from_interest_on_debentures_and_bonds_reported,Current_weekly_income_from_interest_on_loans_to_persons_not_in_this_household_reported,Current_weekly_income_from_newstart_allowance,Current_weekly_income_from_non_residential_property_reported,Current_weekly_income_from_non_residential_property_flag_reported,Current_weekly_income_from_other_financial_investments_reported,Current_weekly_income_from_other_government_pensions_and_allowances,Current_weekly_income_from_overseas_pensions_and_benefits,Current_weekly_income_from_paid_out_unused_leave,Current_weekly_income_from_parenting_payment,Current_weekly_income_from_partner_allowance,Current_weekly_income_from_pension_supplement,Current_weekly_income_from_public_unit_trusts,Current_weekly_income_from_redundancy_pay,Current_weekly_income_from_regular_sources_n_e_c,Current_weekly_income_from_regular_workers_compensation,Current_weekly_income_from_residential_property_reported,Current_weekly_income_from_residential_property_flag_reported,Current_weekly_income_from_royalties_reported,Current_weekly_income_from_scholarships,Current_weekly_income_from_senior_supplement,Current_weekly_income_from_service_pension_DVA,Current_weekly_income_from_sickness_allowance,Current_weekly_income_from_special_benefit,Current_weekly_income_from_superannuation_annuity_private_pension,Current_weekly_income_from_utilities_allowance,Current_weekly_income_from_war_widows_pension_DVA,Current_weekly_income_from_widow_allowance,Current_weekly_income_from_wife_pension,Current_weekly_income_from_workers_compensation_lump_sum,Current_weekly_income_from_youth_allowance,Current_weekly_income_of_children_from_investments_HES_only,Current_weekly_income_of_children_from_sources_n_e_c_HES_only,Current_weekly_income_of_children_from_unincorporated_business_HES_only,Current_weekly_interest_paid_on_money_borrowed_to_purchase_shares_or_units_in_trusts,Current_weekly_net_income_from_public_unit_trusts,Current_weekly_other_non_cash_benefit_from_employer_non_salary_sacrifice,Current_weekly_payments_for_child_support_spousal_maintenance,Duration_of_unemployment,Education_status,Educational_institution_attending,Expected_current_weekly_paid_overtime_this_financial_year,Extended_family_number,Family_type,Financial_stress_respondent_flag_HES_only,First_language_spoken,Flag_to_indicate_person_level_imputation,Full_time_part_time_labour_force_status,Highest_year_of_school_completed,Imputation_flag_for_AGEPE_module,Imputation_flag_for_BUSINC_module,Imputation_flag_for_CHASS_module,Imputation_flag_for_CHINC_module,Imputation_flag_for_COMPO_module,Imputation_flag_for_CURBUSINC_module,Imputation_flag_for_CURRENTI_module,Imputation_flag_for_FAMBEN_module,Imputation_flag_for_FINSUPP_module,Imputation_flag_for_INTER_module,Imputation_flag_for_LUMPR_module,Imputation_flag_for_module_formal_child_care_attends_school,Imputation_flag_for_module_formal_child_care_does_not_attend_school,Imputation_flag_for_module_informal_child_care,Imputation_flag_for_module_preschool,Imputation_flag_for_NONCASH_module,Imputation_flag_for_PAYOUTHH_module,Imputation_flag_for_PENAL_module,Imputation_flag_for_PREVINC_module,Imputation_flag_for_PREVPEN_module,Imputation_flag_for_PREVREGIN_module,Imputation_flag_for_REGIN_module,Imputation_flag_for_RENTI_module,Imputation_flag_for_SALSAC_module,Imputation_flag_for_SCHOL_module,Imputation_flag_for_SECIN_module,Imputation_flag_for_SILENT_module,Imputation_flag_for_SOUIN_module,Imputation_flag_for_STRP_module,Imputation_flag_for_SUPER_module,Imputation_flag_for_TRUST_module,Imputation_flag_for_VALOTH_module,Imputation_flag_for_WSEINC_module,Imputed_current_weekly_tax_payable,Imputed_current_weekly_tax_payable_basis,Imputed_tax_payable_for_prev_fin_year,Imputed_tax_payable_for_prev_fin_year_basis,Income_unit_number_within_each_family_in_the_household,Income_unit_type_person,Industry_of_main_job,Labour_force_status,Landlord_type_Person,Level_identifier_person_level,Level_of_highest_educational_attainment,Level_of_highest_non_school_qualification,Loan_number,Looked_for_work,Main_field_of_highest_non_school_qualification,Main_language_spoken_at_home,Main_reason_lack_of_child_care_prevents_parent_from_working,Main_source_of_current_income,Main_source_of_current_income_basis,Main_source_of_prev_fin_year_income,Main_source_of_prev_fin_year_income_basis,Not_in_the_labour_force_status,Number_of_additional_hours_parent_would_like_to_work,Number_of_hours_parent_would_like_to_work_if_was_offered_a_job_and_suitable_child_care_was_available,Number_of_hours_usually_worked_per_week_in_main_and_second_jobs,Number_of_hours_usually_worked_per_week_in_main_job,Number_of_hours_usually_worked_per_week_in_second_job,Number_of_jobs_currently_held,Occupation_in_main_job,Parent_or_guardian_flag,Person_number_within_each_income_unit,Person_previous_financial_year_exclusion_flag,Personal_irregular_receipts_from_accident_compensation_over_last_years,Personal_irregular_receipts_from_legal_damages_over_last_years,Personal_irregular_receipts_from_life_insurance_payments_over_last_years,Personal_irregular_receipts_from_matrimonial_settlements_over_last_years,Personal_irregular_receipts_from_other_sources_over_last_years,Personal_irregular_receipts_from_superannuation_payments_over_last_years,Personal_receipts_from_inheritances_or_bequests_over_last_years,Personal_receipts_from_windfall_gains_winnings_over_last_years,Position_in_income_unit_relationship_to_the_IU_reference_person,Position_in_the_household_publication_definition,Prev_fin_year_cash_employee_income_from_all_jobs_excluding_incorporated_business,Prev_fin_year_cash_employee_income_from_incorporated_business,Prev_fin_year_Child_Care_Tax_Rebate_amount,Prev_fin_year_employee_income_from_all_jobs,Prev_fin_year_employee_income_from_all_jobs_incl_STRPs,Prev_fin_year_financial_support_provided_to_family_members_not_in_the_household,Prev_fin_year_income_as_beneficiary_of_a_trust_excl_public_unit_trusts_and_employment_income,Prev_fin_year_income_as_silent_partner,Prev_fin_year_income_from_accident_compensation_and_sickness_insurance,Prev_fin_year_income_from_age_pension,Prev_fin_year_income_from_Austudy_Abstudy,Prev_fin_year_income_from_Baby_Bonus_payment,Prev_fin_year_income_from_carer_allowance,Prev_fin_year_income_from_carer_payment,Prev_fin_year_income_from_child_support_maintenance,Prev_fin_year_income_from_disability_pension_DVA,Prev_fin_year_income_from_disability_support_pension,Prev_fin_year_income_from_dividends,Prev_fin_year_income_from_family_members_not_living_in_the_household,Prev_fin_year_income_from_family_tax_benefits,Prev_fin_year_income_from_financial_institution_account_interest,Prev_fin_year_income_from_interest_on_debentures_and_bonds,Prev_fin_year_income_from_interest_on_loans_to_persons_not_in_this_household,Prev_fin_year_income_from_newstart_allowance,Prev_fin_year_income_from_non_residential_property,Prev_fin_year_income_from_non_residential_property_flag,Prev_fin_year_income_from_other_financial_investments,Prev_fin_year_income_from_other_government_pensions_and_allowances,Prev_fin_year_income_from_overseas_pensions_and_benefits,Prev_fin_year_income_from_own_unincorporated_business,Prev_fin_year_income_from_own_unincorporated_business_flag,Prev_fin_year_income_from_paid_out_unused_leave,Prev_fin_year_income_from_parenting_payment,Prev_fin_year_income_from_partner_allowance,Prev_fin_year_income_from_public_unit_trusts,Prev_fin_year_income_from_redundancy_pay,Prev_fin_year_income_from_regular_sources_n_e_c,Prev_fin_year_income_from_regular_workers_compensation,Prev_fin_year_income_from_residential_property,Prev_fin_year_income_from_residential_property_flag,Prev_fin_year_income_from_royalties,Prev_fin_year_income_from_scholarships,Prev_fin_year_income_from_service_pension_DVA,Prev_fin_year_income_from_sickness_allowance,Prev_fin_year_income_from_special_benefit,Prev_fin_year_income_from_superannuation_annuity_private_pension,Prev_fin_year_income_from_war_widows_pension_DVA,Prev_fin_year_income_from_widow_allowance,Prev_fin_year_income_from_wife_pension,Prev_fin_year_income_from_youth_allowance,Prev_fin_year_interest_paid_on_money_borrowed_to_purchase_shares_or_units_in_trusts,Prev_fin_year_net_income_from_public_unit_trusts,Prev_fin_year_payments_for_child_support_spousal_maintenance,Previous_financial_year_total_family_tax_benefits_modelled,Proficiency_in_spoken_English,Record_Identifier_for_expenditure_COICOP_level,Record_Identifier_for_expenditure_level,Relationship_in_household,Severity_of_disability,Sex,Social_marital_status,Status_in_employment_main_job,Status_in_employment_main_job_standard,Status_in_employment_second_job,Tenure_Person,Total_current_weekly_employee_income_as_reported,Total_current_weekly_employee_income_incl_overtime_salary_sacrifice_bonuses_and_STRP,Total_current_weekly_employee_income_incl_salary_sacrifice,Total_current_weekly_employee_income_salary_sacrificed,Total_current_weekly_income_from_all_sources,Total_current_weekly_income_from_all_sources_basis,Total_current_weekly_income_from_government_pensions_and_allowances,Total_current_weekly_income_from_government_pensions_and_allowances_basis,Total_current_weekly_income_from_investments_incl_silent_partner_income_shares_trusts_net_of_expenses,Total_current_weekly_income_from_investments_reported,Total_current_weekly_income_from_other_regular_sources,Total_current_weekly_income_from_other_sources_incl_WC_lump_sums,Total_current_weekly_income_of_children_HES_only,Total_current_weekly_non_cash_benefits_from_employer_non_salary_sacrifice,Total_prev_fin_year_income_from_all_sources,Total_prev_fin_year_income_from_all_sources_basis,Total_prev_fin_year_income_from_government_pensions_and_allowances,Total_prev_fin_year_income_from_investments,Total_prev_fin_year_income_from_other_regular_sources,Total_prev_fin_year_income_from_other_sources_incl_WC_lump_sums,Total_prev_year_income_from_investments_incl_silent_partner_income_shares_trusts_net_of_expenses,Type_of_study_in_current_year,Unique_household_number,Value_of_accounts_held_with_financial_institutions,Value_of_debentures_and_bonds,Value_of_loans_to_persons_not_in_the_same_household,Value_of_other_financial_investments,Value_of_own_incorporated_business_net_of_liabilities,Value_of_own_unincorporated_business_net_of_liabilities,Value_of_private_trusts_person_level,Value_of_public_unit_trusts_person_level,Value_of_shares_person_level,Value_of_silent_partnerships_person_level,Weekly_paid_overtime_included_in_reported_employee_income,Weight_Person_HES,Whether_Centrelink_Commonwealth_seniors_health_card_held_HES_only,Whether_Centrelink_pensioner_concession_card_held_HES_only,Whether_currently_has_private_hospital_cover_FIS,Whether_DOHA_health_care_card_held_HES_only,Whether_had_private_hospital_cover_in_previous_financial_year_FIS,Whether_has_disability_or_long_term_health_condition,Whether_holds_a_DVA_issued_card_HES_only,Whether_parent_prevented_from_working_by_lack_of_child_care,Whether_parent_would_like_a_job_if_suitable_child_care_available,Whether_parent_would_like_a_paid_job,Whether_parent_would_prefer_to_work_more_hours,Whether_reported_employee_income_included_paid_overtime,Whether_reported_employee_income_included_the_amount_salary_sacrificed,Whether_reported_prev_fin_year_income_included_paid_out_unused_leave_amounts,Whether_reported_prev_fin_year_income_included_redundancy_pay_amounts,Year_of_arrival_in_Australia
63 years,0,0,Other,0,0,0,0,0,0,0,0,0,0,0,0,Not applicable,0,0,0,0,0,0,0,0,0,0,0,0,0,0,0,0,0,0,0,0,0,0,322,0,0,0,0,0,0,0,0,0,Not applicable,0,0,0,0,0,0,24.0799999237061,0,0,0,0,0,Not applicable,0,0,0,0,0,0,0,0,0,0,0,0,0,0,0,0,0,0,0,0,Not applicable,Not studying,Not applicable,0,50,Not applicable,Financial stress respondent,Eastern European Languages,Not applicable,Not applicable,Year 12,Not imputed,Not imputed,Not imputed,Not imputed,Not imputed,Not imputed,Not imputed,Not imputed,Not imputed,Not imputed,Not imputed,Not imputed,Not imputed,Not imputed,Not imputed,Not imputed,Not imputed,Not imputed,Not imputed,Not imputed,Not imputed,Not imputed,Not imputed,Not imputed,Not imputed,Not imputed,Not imputed,Not imputed,Not imputed,Not imputed,Not imputed,Not imputed,Not imputed,0,0,0,0,1,Lone person,Not applicable,Not in the labour force,Not applicable,0,Bachelor Degree,Bachelor Degree,0,Did not look for full-time work,Information technology,Other language,Not applicable,Government pensions and allowances,Government pensions and allowances,Government pensions and allowances,Government pensions and allowances,Other - not in the labour force (including unpaid voluntary worker),0,0,0 hours worked,0 hours worked,0 hours worked,Not applicable,Not applicable,Is not a parent or guardian of child aged under 12 years,1,In scope for both period and current income analysis,0,0,0,0,0,0,0,0,Reference person of income unit,Household reference person,0,0,0,0,0,0,0,0,0,0,0,0,0,0,0,0,15000,0,0,0,0,0,0,0,0,Not applicable,0,0,0,0,Not applicable,0,0,0,0,0,0,0,0,Not applicable,0,0,0,0,0,0,0,0,0,0,0,0,0,0,Well,0,6,Non-family member,Moderate core activity limitation,Male,Not married,Not applicable,Not applicable,Not applicable,Owner without a mortgage,0,0,0,0,346.079986572266,346.079986572266,346.079986572266,346.079986572266,0,0,0,0,0,0,15900,15900,15900,0,0,0,0,Not applicable,HES10B1000001,2000,0,0,0,0,0,0,0,0,0,0,49.8165588378906,Not applicable,Yes,0,Not applicable,0,Disability or long-term health condition,2,Not applicable,Not applicable,Not applicable,Not applicable,Not applicable,Not applicable,Not applicable,Not applicable,Arrived 1985 and before
50 to 54 years,0,3000,Australia,0,0,0,0,0,0,0,0,0,0,0,0,Not applicable,0,0,0,0,0,0,0,0,0,0,0,0,0,0,0,0,0,0,0,0,0,0,0,0,0,0,0,0,0,0,67,0,Not applicable,0,0,0,0,0,0,0,0,0,0,0,0,Not applicable,0,0,0,0,0,0,0,0,0,0,0,0,0,0,0,0,0,0,0,0,Not applicable,Not studying,Not applicable,0, 1,Couple only,Financial stress respondent,English only,Not applicable,Part time,Year 10,Not imputed,Not imputed,Not imputed,Not imputed,Not imputed,Not imputed,Not imputed,Not imputed,Not imputed,Not imputed,Not imputed,Not imputed,Not imputed,Not imputed,Not imputed,Not imputed,Not imputed,Not imputed,Not imputed,Not imputed,Not imputed,Not imputed,Not imputed,Not imputed,Not imputed,Not imputed,Not imputed,Not imputed,Not imputed,Not imputed,Not imputed,Not imputed,Not imputed,11.8800001144409,11.8800001144409,0,0,1,Couple without dependent children,Administrative and Support Services,Employed,Not applicable,0,Certificate III/IV,Certificate III/IV,2,Not applicable,Education,English,Not applicable,Wage and salary,Wage and salary,Government pensions and allowances,Government pensions and allowances,Not applicable,0,0,20-21 hours worked,20-21 hours worked,0 hours worked,One job only,Labourers,Is not a parent or guardian of child aged under 12 years,3,In scope for both period and current income analysis,0,0,0,0,0,0,0,0,Reference person of income unit,Household reference person,0,0,0,0,0,0,0,0,0,0,0,0,0,0,0,0,0,0,0,0,3,0,0,4744,0,Not applicable,0,0,0,0,Nil value,0,0,0,0,0,0,0,0,Not applicable,0,0,0,0,8107,0,0,0,0,0,0,0,0,0,Not applicable,0,1,"Husband, wife or partner",No disability or long-term health condition,Male,Married,"Employee part-time, paid in cash",Employee,Not applicable,Other,323.5,323.5,323.5,0,390.5,390.5,67,67,0,0,0,0,0,0,13754,13754,13751,3,0,0,3,Not applicable,HES10B1000002,750,0,0,0,0,0,0,0,0,0,0,1180.0224609375,Not applicable,Not applicable,0,Yes,2,No disability or long-term health condition,1,Not applicable,Not applicable,Not applicable,Not applicable,Overtime not included in reported employee income,Not applicable,Not applicable,Not applicable,Born in Australia
50 to 54 years,0,200,Australia,0,0,0,0,0,0,0,0,0,0,0,0,Not applicable,0,0,0,0,0,0,0,0,0,0,0,0,0,0,0,0,0,0,0,0,0,0,0,0,0,0,0,0,0,0,51,0,Not applicable,0,0,0,0,0,0,0,0,0,0,0,0,Not applicable,0,0,0,0,0,0,0,0,0,0,0,0,0,0,0,0,0,0,0,0,Not applicable,Not studying,Not applicable,0, 1,Couple only,Not applicable,English only,Not applicable,Part time,Year 10,Not imputed,Not imputed,Not imputed,Not imputed,Not imputed,Not imputed,Not imputed,Not imputed,Not imputed,Not imputed,Not imputed,Not imputed,Not imputed,Not imputed,Not imputed,Not imputed,Not imputed,Not imputed,Not imputed,Not imputed,Not imputed,Not imputed,Not imputed,Not imputed,Not imputed,Not imputed,Not imputed,Not imputed,Not imputed,Not imputed,Not imputed,Not imputed,Not imputed,0,0,0,0,1,Couple without dependent children,Administrative and Support Services,Employed,Not applicable,0,Certificate III/IV,Certificate III/IV,2,Not applicable,Management and commerce,English,Not applicable,Wage and salary,Wage and salary,Government pensions and allowances,Government pensions and allowances,Not applicable,0,0,6-7 hours worked,6-7 hours worked,0 hours worked,One job only,Labourers,Is not a parent or guardian of child aged under 12 years,3,In scope for both period and current income analysis,0,0,0,0,0,0,0,0,Partner of reference person of income unit,Spouse/partner of household reference person,0,0,0,0,0,0,0,0,0,0,0,0,0,0,0,0,0,0,0,0,3,0,0,4777,0,Not applicable,0,0,0,0,Nil value,0,0,0,0,0,0,0,0,Not applicable,0,0,0,0,8107,0,0,0,0,0,0,0,0,0,Not applicable,0,1,"Husband, wife or partner",No disability or long-term health condition,Female,Married,"Employee part-time, paid in cash",Employee,Not applicable,Other,155,155,155,0,206,206,51,51,0,0,0,0,0,0,12887,12887,12884,3,0,0,3,Not applicable,HES10B1000002,750,0,0,0,0,0,0,0,0,0,0,1180.0224609375,Not applicable,Not applicable,0,Yes,2,No disability or long-term health condition,1,Not applicable,Not applicable,Not applicable,Not applicable,Overtime not included in reported employee income,Not applicable,Not applicable,Not applicable,Born in Australia
70 to 74 years,0,0,Australia,0,0,0,0,0,0,0,0,0,0,0,-19,Loss,0,0,0,0,0,0,0,0,0,0,0,0,0,0,0,0,0,0,0,0,0,0,0,4,0,0,0,40,0,0,0,398,Profit,0,0,0,0,0,0,0,0,0,0,0,0,Not applicable,0,0,12.8100004196167,0,0,0,0,0,0,0,0,0,0,0,0,0,0,0,0,0,Not applicable,Not studying,Not applicable,0, 1,Couple only,Financial stress respondent,English only,Not applicable,Not applicable,Year 8 or below including never attended school,Not imputed,Not imputed,Not imputed,Not imputed,Not imputed,Not imputed,Not imputed,Not imputed,Not imputed,Not imputed,Not imputed,Not imputed,Not imputed,Not imputed,Not imputed,Not imputed,Not imputed,Not imputed,Not imputed,Not imputed,Not imputed,Not imputed,Not imputed,Not imputed,Not imputed,Not imputed,Not imputed,Not imputed,Not imputed,Not imputed,Not imputed,Not imputed,Not imputed,24.6299991607666,24.6299991607666,1762.93,1762.93,1,Couple without dependent children,Not applicable,Not in the labour force,Not applicable,0,Year 8 or below including never attended school,No non-school qualification,0,Did not look for full-time work,Not applicable,English,Not applicable,Other income,Other income,Other income,Other income,Other - not in the labour force (including unpaid voluntary worker),0,0,0 hours worked,0 hours worked,0 hours worked,Not applicable,Not applicable,Is not a parent or guardian of child aged under 12 years,5,In scope for both period and current income analysis,0,0,0,0,0,0,0,0,Partner of reference person of income unit,Spouse/partner of household reference person,0,0,0,0,0,0,0,0,0,0,0,0,0,0,0,0,0,202,0,0,2895,0,0,0,20956,Profit,0,0,0,0,Nil value,0,0,0,0,0,0,0,0,Not applicable,0,0,0,0,0,0,0,0,0,0,0,0,0,0,Not applicable,0,1,"Husband, wife or partner",No disability or long-term health condition,Female,Married,Not applicable,Not applicable,Not applicable,Owner without a mortgage,0,0,0,0,433.220001220703,433.220001220703,12.8100004196167,12.8100004196167,439.410003662109,439.410003662109,0,0,0,0,24765,24765,1050,23715,0,0,23715,Not applicable,HES10B1000003,39750,0,0,0,0,225000,0,0,3099,0,0,634.60302734375,Yes,Not applicable,0,Not applicable,0,No disability or long-term health condition,1,Not applicable,Not applicable,Not applicable,Not applicable,Not applicable,Not applicable,Not applicable,Not applicable,Born in Australia
75 to 79 years,0,0,Australia,0,0,0,0,0,0,0,0,0,0,0,-19,Loss,0,0,0,0,0,0,0,0,0,0,0,0,0,0,0,0,0,0,0,0,0,0,0,4,0,0,0,40,0,0,0,392,Profit,0,0,0,0,0,0,0,0,0,0,0,0,Not applicable,0,0,12.8100004196167,0,0,0,0,0,0,0,0,0,0,0,0,0,0,0,0,0,Not applicable,Not studying,Not applicable,0, 1,Couple only,Not applicable,English only,Not applicable,Part time,Year 8 or below including never attended school,Not imputed,Not imputed,Not imputed,Not imputed,Not imputed,Not imputed,Not imputed,Not imputed,Not imputed,Not imputed,Not imputed,Not imputed,Not imputed,Not imputed,Not imputed,Not imputed,Not imputed,Not imputed,Not imputed,Not imputed,Not imputed,Not imputed,Not imputed,Not imputed,Not imputed,Not imputed,Not imputed,Not imputed,Not imputed,Not imputed,Not imputed,Not imputed,Not imputed,23.3799991607666,23.3799991607666,1809.16,1809.16,1,Couple without dependent children,"Agriculture, Forestry and Fishing",Employed,Not applicable,0,Year 8 or below including never attended school,No non-school qualification,2,Not applicable,Not applicable,English,Not applicable,Other income,Other income,Other income,Other income,Not applicable,0,0,22-23 hours worked,22-23 hours worked,0 hours worked,One job only,Managers and Administrators,Is not a parent or guardian of child aged under 12 years,5,In scope for both period and current income analysis,0,0,0,0,0,0,0,0,Reference person of income unit,Household reference person,0,0,0,0,0,0,0,0,0,0,0,0,0,0,0,0,0,202,0,0,2780,0,0,0,21354,Profit,0,0,0,0,Nil value,0,0,0,0,0,0,0,0,Not applicable,0,0,0,0,0,0,0,0,0,0,0,0,0,0,Not applicable,0,1,"Husband, wife or partner",No specific limitation or restriction,Male,Married,"Own account worker, contributing family worker and employee paid in kind",Own account worker and contributing family worker,Not applicable,Owner without a mortgage,0,0,0,0,433.220001220703,433.220001220703,12.8100004196167,12.8100004196167,439.410003662109,439.410003662109,0,0,0,0,24650,24650,1050,23600,0,0,23600,Not applicable,HES10B1000003,39825,0,0,0,0,225000,0,0,3062,0,0,634.60302734375,Yes,Not applicable,0,Not applicable,0,Disability or long-term health condition,1,Not applicable,Not applicable,Not applicable,Not applicable,Not applicable,Not applicable,Not applicable,Not applicable,Born in Australia
